{
  "$schema": "https://json-schema.org/draft/2020-12/schema",
  "$id": "https://satellitesim.org/schemas/experiment-v1.schema.json",
  "title": "SatelliteSimJulia reproducible experiment",
  "type": "object",
  "additionalProperties": false,
  "required": ["name", "constellation"],
  "properties": {
    "schema_version": {
      "description": "Optional for legacy v1 documents; omission is normalized to this v1 identifier.",
      "const": "satellitesim.experiment/v1",
      "default": "satellitesim.experiment/v1"
    },
    "name": {"type": "string", "minLength": 1, "maxLength": 128},
    "constellation": {
      "oneOf": [
        {"type": "string", "minLength": 1},
        {
          "type": "object",
          "additionalProperties": false,
          "required": ["T", "P", "F", "alt_km", "inc_deg"],
          "properties": {
            "T": {"type": "integer", "minimum": 1},
            "P": {"type": "integer", "minimum": 1},
            "F": {"type": "integer", "minimum": 0},
            "alt_km": {"type": "number", "exclusiveMinimum": 0},
            "inc_deg": {"type": "number", "minimum": 0, "maximum": 180}
          }
        }
      ]
    },
    "propagator": {"type": "string", "enum": ["two_body", "j2", "j4"]},
    "orbit_backend": {
      "oneOf": [
        {"type": "null"},
        {"type": "string", "minLength": 1},
        {
          "type": "object",
          "additionalProperties": false,
          "required": ["name"],
          "properties": {
            "name": {"type": "string", "minLength": 1},
            "options": {
              "type": "object",
              "propertyNames": {"pattern": "^[A-Za-z][A-Za-z0-9_]*$"},
              "additionalProperties": {"type": ["string", "number", "boolean"]}
            }
          }
        }
      ]
    },
    "gsl_backend": {
      "description": "Execution backend for batched GSL evaluation only; defaults to cpu.",
      "oneOf": [
        {"type": "null"},
        {"type": "string", "minLength": 1},
        {
          "type": "object",
          "additionalProperties": false,
          "required": ["name"],
          "properties": {
            "name": {"type": "string", "minLength": 1},
            "options": {
              "type": "object",
              "propertyNames": {"pattern": "^[A-Za-z][A-Za-z0-9_]*$"},
              "additionalProperties": {"type": ["string", "number", "boolean"]}
            }
          }
        }
      ]
    },
    "tspan": {
      "type": "array",
      "minItems": 2,
      "maxItems": 2,
      "items": {"type": "number"}
    },
    "steps": {"type": "integer", "minimum": 2, "maximum": 10000},
    "topology_strategy": {"type": "string", "enum": ["balanced", "mesh", "gridplus", "grid_plus"]},
    "routing_algorithm": {"type": "string", "enum": ["dijkstra", "ecmp", "min_load"]},
    "traffic": {"type": "string", "enum": ["uniform", "hotspot"]},
    "ground_pairs": {
      "type": "array",
      "description": "1-based indices into the merged ground endpoint list (users + ground_endpoints).",
      "items": {
        "type": "array",
        "minItems": 2,
        "maxItems": 2,
        "items": {"type": "integer", "minimum": 1}
      }
    },
    "ground_endpoints": {
      "type": "array",
      "description": "Unified ground endpoints for coverage, GSL, and traffic.",
      "items": {
        "type": "object",
        "additionalProperties": false,
        "required": ["id", "lat", "lon"],
        "properties": {
          "id": {"type": "string", "minLength": 1},
          "lat": {"type": "number", "minimum": -90, "maximum": 90},
          "lon": {"type": "number", "minimum": -180, "maximum": 180},
          "alt_km": {"type": "number"},
          "uplink_demand_mbps": {"type": "number", "minimum": 0},
          "downlink_demand_mbps": {"type": "number", "minimum": 0},
          "service_type": {"type": ["string", "null"]},
          "tags": {
            "type": "object",
            "additionalProperties": {"type": "string"}
          }
        }
      }
    },
    "users": {
      "type": "array",
      "items": {
        "type": "object",
        "additionalProperties": false,
        "required": ["id", "lat", "lon"],
        "properties": {
          "id": {"type": "string", "minLength": 1},
          "lat": {"type": "number", "minimum": -90, "maximum": 90},
          "lon": {"type": "number", "minimum": -180, "maximum": 180},
          "uplink_demand_mbps": {"type": "number", "minimum": 0},
          "downlink_demand_mbps": {"type": "number", "minimum": 0},
          "service_type": {"type": ["string", "null"]}
        }
      }
    },
    "random_seed": {"type": "integer", "minimum": 0},
    "alpha": {"type": "number", "minimum": 0, "maximum": 1}
  },
  "allOf": [
    {
      "if": {
        "required": ["gsl_backend"],
        "properties": {
          "gsl_backend": {
            "oneOf": [
              {"type": "string", "not": {"const": "cpu"}},
              {
                "type": "object",
                "required": ["name"],
                "properties": {"name": {"not": {"const": "cpu"}}}
              }
            ]
          }
        }
      },
      "then": {
        "required": ["users"],
        "properties": {"users": {"minItems": 1}}
      }
    }
  ]
}
